<train xmlns:xsi="http://www.w3.org/2001/XMLSchema-instance" xsi:noNamespaceSchemaLocation="../xsdFiles/railway.xsd">
    <name>Parasuram</name>
    <no>201</no>
    <from>Trivandrum</from>
    <to>Kasarcode</to>
    <type>Express</type>
    <start>05:00:00</start>
    <duration>20.0</duration>
    <reservation>
      <serial_no>123201</serial_no>
      <date>2005-03-05</date>
      <class>Second</class>
      <from>Trivandrum</from>
      <to>Palakkad</to>
      <passenger>
        <name>BGH</name>
        <age>21</age>
        <sex>Male</sex>
        <address>Deepthi</address>
      </passenger>
    </reservation>
     <route>
    <via>Kottayam</via>
    <type_of_track>Broadgauge</type_of_track>
    <length>720.0</length>
    <no_of_stations>49</no_of_stations>
    <starting_zone>
      <name>southzone</name>
      <no_of_states>4.0</no_of_states>
    </starting_zone>
    <ending_zone>
      <name>southzone</name>
      <no_of_states>4.0</no_of_states>
    </ending_zone>
  </route>
  </train>
